{
  "$schema": "../../templates/upstream-intake.schema.json",
  "schema": "ds-tis/upstream-intake",
  "schemaVersion": 2,
  "id": "2026-07-29-vnext-accordion",
  "component": {
    "name": "Accordion",
    "slug": "accordion",
    "classification": "disclosure-group"
  },
  "authorization": {
    "approvedScope": [
      "preserve-web-accordion",
      "ark-zag-accordion-implementation",
      "react-shadcn-base-ui-accordion-implementation",
      "three-output-documentation",
      "functional-accessibility-visual-performance-validation"
    ],
    "blockedActions": [
      "figma-write",
      "web-core-write",
      "adapter-write",
      "commit-push-release"
    ],
    "ownerDecision": "O owner aprovou o piloto Accordion em 2026-07-29 e autorizou execução local contínua em 2026-08-28. Figma, Web core, commit, push e release permanecem bloqueados."
  },
  "baseline": {
    "figma": {
      "fileKey": "IE68amP9Hya5ieFw1rX8S8",
      "page": "Accordion",
      "providerAgnostic": true,
      "evidenceStatus": "snapshot-current",
      "snapshotAgeHoursAtKickoff": 17,
      "writeStatus": "approved-unchanged"
    },
    "sharedContract": {
      "providerAgnostic": true,
      "sharedByAllOutputs": true,
      "tokens": "tokens/component/accordion.json",
      "design": "docs/accordion.html",
      "accessibility": "evidence/current-contract.md"
    }
  },
  "outputs": [
    {
      "id": "web-html-css-js",
      "label": "HTML/CSS/JS",
      "technologyFamily": "native-web",
      "distribution": { "channel": "npm", "package": "ds-tis" },
      "resolutionContext": {
        "css": "css/components/accordion.css",
        "runtime": "js/accordion.js",
        "api": "docs/api/components.json#accordion"
      },
      "status": "stable",
      "sourceModules": ["css/components/accordion.css", "js/accordion.js"],
      "writeStatus": "approved-unchanged"
    },
    {
      "id": "ark-zag",
      "label": "Ark/Zag",
      "technologyFamily": "ark-zag",
      "distribution": { "channel": "technology-adapters", "package": null },
      "resolutionContext": {
        "package": "@ark-ui/react/accordion",
        "arkVersion": "5.37.2",
        "zagVersion": "1.41.2",
        "zagUsage": "transitive-via-ark"
      },
      "status": "beta",
      "sourceModules": [
        "packages/react/src/ark/accordion.jsx",
        "@ark-ui/react/accordion",
        "@zag-js/accordion (transitive via Ark UI)"
      ],
      "writeStatus": "authorized"
    },
    {
      "id": "react-shadcn-base-ui",
      "label": "React · shadcn/Base UI",
      "technologyFamily": "base-ui",
      "distribution": { "channel": "shadcn-registry", "namespace": "@tis" },
      "resolutionContext": {
        "base": "base",
        "package": "@base-ui/react/accordion",
        "baseUiVersion": "1.6.0"
      },
      "status": "beta",
      "sourceModules": ["registry/tis/accordion.tsx", "@base-ui/react/accordion"],
      "writeStatus": "authorized"
    }
  ],
  "separation": {
    "dependencyDirection": "figma-and-tokens -> three-independent-outputs -> documentation-choice",
    "outputsCoexist": true,
    "outputSourcesMustRemainSeparate": true,
    "oneOutputCannotReplaceAnother": true,
    "sharedContractDoesNotMeanSharedImplementation": true
  },
  "parity": {
    "requiredDimensions": [
      "tis-contract-parity",
      "aria-keyboard-focus-disabled",
      "single-multiple-controlled-uncontrolled",
      "bundle-and-dependencies",
      "real-consumer-installation"
    ],
    "status": "approved",
    "ownerApproval": {
      "at": "2026-08-28",
      "note": "Owner autorizou execução contínua; paridade validada por testes funcionais, visuais, acessíveis e de bundle."
    },
    "selectsWinner": false,
    "allowsDocumentedDifferences": true
  },
  "documentation": {
    "selectionMode": "user-choice",
    "trackIds": ["web-html-css-js", "ark-zag", "react-shadcn-base-ui"],
    "defaultTrack": "web-html-css-js",
    "showsUnavailableState": true,
    "status": "implemented"
  },
  "figmaOutcome": {
    "status": "approved-unchanged",
    "allowedOutcomes": ["unchanged-with-evidence", "improvement-proposal"],
    "requiresOwnerApproval": true
  },
  "gates": [
    { "id": "current-state", "status": "done", "evidence": "evidence/current-contract.md" },
    { "id": "upstream-benchmark", "status": "done", "evidence": "evidence/upstream-benchmark.md" },
    { "id": "current-contract", "status": "done", "evidence": "evidence/provider-comparison.md" },
    { "id": "improvement-classification", "status": "done", "evidence": "evidence/provider-comparison.md" },
    { "id": "brief-owner-approval", "status": "approved", "ownerApproval": { "at": "2026-07-29", "note": "Owner autorizou o piloto Accordion." } },
    { "id": "figma-outcome", "status": "approved", "ownerApproval": { "at": "2026-07-30", "note": "Draft Figma auditado e aprovado; nenhuma mudança nesta rodada." } },
    { "id": "output-implementation", "status": "done" },
    { "id": "parity-validation", "status": "done" },
    { "id": "documentation-selector", "status": "done" },
    { "id": "release", "status": "pending" }
  ],
  "evidence": [
    { "type": "repo-contract", "path": "evidence/current-contract.md", "scope": "run", "status": "current", "freshness": "fresh" },
    { "type": "upstream-benchmark", "path": "evidence/upstream-benchmark.md", "scope": "run", "status": "current", "freshness": "fresh" },
    { "type": "output-parity", "path": "evidence/provider-comparison.md", "scope": "run", "status": "current", "freshness": "fresh" },
    { "type": "figma-screenshot", "path": "evidence/figma-accordion-vnext-after-audit.png", "scope": "run", "status": "current", "freshness": "fresh" },
    { "type": "repo-validation", "path": "06-repo-implementation-report.md", "scope": "run", "status": "current", "freshness": "fresh" },
    { "type": "visual-comparison-web", "path": "evidence/web-open-2026-08-28.png", "scope": "run", "status": "current", "freshness": "fresh" },
    { "type": "visual-comparison-ark", "path": "evidence/ark-open-2026-08-28.png", "scope": "run", "status": "current", "freshness": "fresh" },
    { "type": "visual-comparison-react", "path": "evidence/react-open-2026-08-28.png", "scope": "run", "status": "current", "freshness": "fresh" }
  ]
}
