{
  "$schema": "../../templates/upstream-intake.schema.json",
  "schema": "ds-tis/upstream-intake",
  "schemaVersion": 2,
  "id": "2026-08-28-toggle-upstream-intake",
  "component": { "name": "Toggle", "slug": "toggle", "classification": "binary-form-control" },
  "authorization": {
    "approvedScope": ["preserve-web-toggle", "ark-zag-toggle-implementation", "three-output-documentation", "functional-accessibility-visual-performance-validation"],
    "blockedActions": ["figma-write", "web-core-write", "adapter-write", "commit-push-release"],
    "ownerDecision": "Owner autorizou executar, testar e validar cada componente em sequência sem novas esperas, preservando Figma e Web."
  },
  "baseline": {
    "figma": { "fileKey": "IE68amP9Hya5ieFw1rX8S8", "page": "Toggle", "providerAgnostic": true, "evidenceStatus": "snapshot-current", "snapshotAgeHoursAtKickoff": 17, "writeStatus": "approved-unchanged" },
    "sharedContract": { "providerAgnostic": true, "sharedByAllOutputs": true, "tokens": "tokens/component/toggle.json", "design": "docs/toggle.html", "accessibility": "evidence/current-contract.md" }
  },
  "outputs": [
    { "id": "web-html-css-js", "label": "HTML/CSS/JS", "technologyFamily": "native-web", "distribution": { "channel": "npm", "package": "ds-tis" }, "resolutionContext": { "css": "css/components/toggle.css", "runtime": null, "api": "docs/api/components.json#toggle" }, "status": "stable", "sourceModules": ["css/components/toggle.css"], "writeStatus": "approved-unchanged" },
    { "id": "ark-zag", "label": "Ark/Zag", "technologyFamily": "ark-zag", "distribution": { "channel": "technology-adapters", "package": null }, "resolutionContext": { "package": "@ark-ui/react/switch", "arkVersion": "5.37.2", "zagVersion": "1.41.2", "zagUsage": "transitive-via-ark" }, "status": "validated", "sourceModules": ["packages/react/src/ark/toggle.jsx", "@ark-ui/react/switch", "@zag-js/switch (transitive via Ark UI)"], "writeStatus": "authorized" },
    { "id": "react-shadcn-base-ui", "label": "React · shadcn/Base UI", "technologyFamily": "base-ui", "distribution": { "channel": "shadcn-registry", "namespace": "@tis" }, "resolutionContext": { "base": "base", "package": "@base-ui/react/switch", "baseUiVersion": "1.6.0" }, "status": "validated", "sourceModules": ["registry/tis/switch.tsx", "@base-ui/react/switch"], "writeStatus": "approved-unchanged" }
  ],
  "separation": { "dependencyDirection": "figma-and-tokens -> three-independent-outputs -> documentation-choice", "outputsCoexist": true, "outputSourcesMustRemainSeparate": true, "oneOutputCannotReplaceAnother": true, "sharedContractDoesNotMeanSharedImplementation": true },
  "parity": { "requiredDimensions": ["tis-contract-parity", "on-off-disabled", "space-label-and-form-integration", "responsive-overflow", "bundle-and-dependencies"], "status": "approved", "ownerApproval": { "at": "2026-08-28", "note": "Owner autorizou execução contínua e fechamento após validação integral." }, "selectsWinner": false, "allowsDocumentedDifferences": true },
  "documentation": { "selectionMode": "user-choice", "trackIds": ["web-html-css-js", "ark-zag", "react-shadcn-base-ui"], "defaultTrack": "web-html-css-js", "showsUnavailableState": true, "status": "passed" },
  "figmaOutcome": { "status": "approved-unchanged", "allowedOutcomes": ["unchanged-with-evidence", "improvement-proposal"], "requiresOwnerApproval": true },
  "gates": [
    { "id": "current-state", "status": "done", "evidence": "evidence/current-contract.md" },
    { "id": "upstream-benchmark", "status": "done", "evidence": "evidence/upstream-benchmark.md" },
    { "id": "current-contract", "status": "done", "evidence": "evidence/provider-comparison.md" },
    { "id": "improvement-classification", "status": "done", "evidence": "evidence/provider-comparison.md" },
    { "id": "brief-owner-approval", "status": "approved", "ownerApproval": { "at": "2026-08-28", "note": "Owner autorizou execução contínua do brief." } },
    { "id": "figma-outcome", "status": "approved", "ownerApproval": { "at": "2026-08-28", "note": "Figma preservado sem mudança." } },
    { "id": "output-implementation", "status": "done" },
    { "id": "parity-validation", "status": "done" },
    { "id": "documentation-selector", "status": "done" },
    { "id": "release", "status": "pending" }
  ],
  "evidence": [
    { "type": "repo-contract", "path": "evidence/current-contract.md", "scope": "run", "status": "current", "freshness": "fresh" },
    { "type": "upstream-benchmark", "path": "evidence/upstream-benchmark.md", "scope": "run", "status": "current", "freshness": "fresh" },
    { "type": "output-parity", "path": "evidence/provider-comparison.md", "scope": "run", "status": "current", "freshness": "fresh" },
    { "type": "figma-snapshot", "path": ".figma-snapshot.json", "scope": "repo", "status": "current", "freshness": "fresh" }
  ]
}
