{
  "$schema": "../../templates/upstream-intake.schema.json",
  "schema": "ds-tis/upstream-intake",
  "schemaVersion": 2,
  "id": "2026-08-28-tooltip-upstream-intake",
  "component": {
    "name": "Tooltip",
    "slug": "tooltip",
    "classification": "non-interactive-informational-overlay"
  },
  "authorization": {
    "approvedScope": [
      "preserve-web-tooltip",
      "ark-zag-tooltip-implementation",
      "react-shadcn-base-ui-tooltip-implementation",
      "three-output-documentation",
      "functional-accessibility-visual-performance-validation"
    ],
    "blockedActions": [
      "figma-write",
      "web-core-write",
      "adapter-write",
      "commit-push-release"
    ],
    "ownerDecision": "Em 2026-08-28 o owner autorizou executar, testar e validar cada componente em sequência sem novas esperas. Figma, Web core, commit, push e release permanecem bloqueados; adapters, docs e testes estão autorizados."
  },
  "baseline": {
    "figma": {
      "fileKey": "IE68amP9Hya5ieFw1rX8S8",
      "page": "Tooltip",
      "providerAgnostic": true,
      "evidenceStatus": "snapshot-current",
      "snapshotAgeHoursAtKickoff": 14,
      "writeStatus": "approved-unchanged"
    },
    "sharedContract": {
      "providerAgnostic": true,
      "sharedByAllOutputs": true,
      "tokens": "tokens/component/tooltip.json",
      "design": "docs/tooltip.html",
      "accessibility": "evidence/current-contract.md"
    }
  },
  "outputs": [
    {
      "id": "web-html-css-js",
      "label": "HTML/CSS/JS",
      "technologyFamily": "native-web",
      "distribution": { "channel": "npm", "package": "ds-tis" },
      "resolutionContext": {
        "css": "css/components/tooltip.css",
        "runtime": "js/tooltip.js",
        "api": "docs/api/components.json#tooltip"
      },
      "status": "stable",
      "sourceModules": ["css/components/tooltip.css", "js/tooltip.js"],
      "writeStatus": "approved-unchanged"
    },
    {
      "id": "ark-zag",
      "label": "Ark/Zag",
      "technologyFamily": "ark-zag",
      "distribution": { "channel": "technology-adapters", "package": null },
      "resolutionContext": {
        "package": "@ark-ui/react/tooltip",
        "arkVersion": "5.37.2",
        "zagVersion": "1.41.2",
        "zagUsage": "transitive-via-ark"
      },
      "status": "beta",
      "sourceModules": [
        "packages/react/src/ark/tooltip.jsx",
        "@ark-ui/react/tooltip",
        "@zag-js/tooltip (transitive via Ark UI)"
      ],
      "writeStatus": "authorized"
    },
    {
      "id": "react-shadcn-base-ui",
      "label": "React · shadcn/Base UI",
      "technologyFamily": "base-ui",
      "distribution": { "channel": "shadcn-registry", "namespace": "@tis" },
      "resolutionContext": {
        "base": "base",
        "package": "@base-ui/react/tooltip",
        "baseUiVersion": "1.6.0"
      },
      "status": "beta",
      "sourceModules": ["registry/tis/tooltip.tsx", "@base-ui/react/tooltip"],
      "writeStatus": "authorized"
    }
  ],
  "separation": {
    "dependencyDirection": "figma-and-tokens -> three-independent-outputs -> documentation-choice",
    "outputsCoexist": true,
    "outputSourcesMustRemainSeparate": true,
    "oneOutputCannotReplaceAnother": true,
    "sharedContractDoesNotMeanSharedImplementation": true
  },
  "parity": {
    "requiredDimensions": [
      "tis-contract-parity",
      "aria-focus-hover-dismiss",
      "four-position-collision-handling",
      "hoverable-content",
      "bundle-and-dependencies",
      "real-consumer-installation"
    ],
    "status": "approved",
    "ownerApproval": {
      "at": "2026-08-28",
      "note": "Owner autorizou execução contínua; paridade validada por foco, Escape, visual, Axe, consumidor e bundle."
    },
    "selectsWinner": false,
    "allowsDocumentedDifferences": true
  },
  "documentation": {
    "selectionMode": "user-choice",
    "trackIds": ["web-html-css-js", "ark-zag", "react-shadcn-base-ui"],
    "defaultTrack": "web-html-css-js",
    "showsUnavailableState": true,
    "status": "implemented"
  },
  "figmaOutcome": {
    "status": "approved-unchanged",
    "allowedOutcomes": ["unchanged-with-evidence", "improvement-proposal"],
    "requiresOwnerApproval": true
  },
  "gates": [
    { "id": "current-state", "status": "done", "evidence": "evidence/current-contract.md" },
    { "id": "upstream-benchmark", "status": "done", "evidence": "evidence/upstream-benchmark.md" },
    { "id": "current-contract", "status": "done", "evidence": "evidence/provider-comparison.md" },
    { "id": "improvement-classification", "status": "done", "evidence": "evidence/provider-comparison.md" },
    { "id": "brief-owner-approval", "status": "approved", "ownerApproval": { "at": "2026-08-28", "note": "Owner autorizou execução contínua do brief." } },
    { "id": "figma-outcome", "status": "approved", "ownerApproval": { "at": "2026-08-28", "note": "Figma preservado sem mudança." } },
    { "id": "output-implementation", "status": "done" },
    { "id": "parity-validation", "status": "done" },
    { "id": "documentation-selector", "status": "done" },
    { "id": "release", "status": "pending" }
  ],
  "evidence": [
    { "type": "repo-contract", "path": "evidence/current-contract.md", "scope": "run", "status": "current", "freshness": "fresh" },
    { "type": "upstream-benchmark", "path": "evidence/upstream-benchmark.md", "scope": "run", "status": "current", "freshness": "fresh" },
    { "type": "output-parity", "path": "evidence/provider-comparison.md", "scope": "run", "status": "current", "freshness": "fresh" },
    { "type": "figma-snapshot", "path": ".figma-snapshot.json", "scope": "repo", "status": "current", "freshness": "fresh" },
    { "type": "repo-validation", "path": "06-repo-implementation-report.md", "scope": "run", "status": "current", "freshness": "fresh" },
    { "type": "visual-comparison-web", "path": "evidence/web-focus-2026-08-28.png", "scope": "run", "status": "current", "freshness": "fresh" },
    { "type": "visual-comparison-ark", "path": "evidence/ark-focus-2026-08-28.png", "scope": "run", "status": "current", "freshness": "fresh" },
    { "type": "visual-comparison-react", "path": "evidence/react-focus-2026-08-28.png", "scope": "run", "status": "current", "freshness": "fresh" }
  ]
}
